Short Description;Long Description;Link;Trait Classification
Seeker Arrow (Sp) (Arcane Archer);At 4th level, an arcane archer can launch an arrow once per day at a target known to her within range, and the arrow travels to the target, even around corners. Only an unavoidable obstacle or the limit of the arrow's range prevents the arrow's flight. This ability negates cover and concealment modifiers, but otherwise the attack is rolled normally. Using this ability is a standard action (and shooting the arrow is part of the action).;https://www.d20srd.org/srd/prestigeClasses/arcaneArcher.htm#seekerArrow;Spell-like Ability (Sp)
Phase Arrow (Sp) (Arcane Archer);At 6th level, an arcane archer can launch an arrow once per day at a target known to her within range, and the arrow travels to the target in a straight path, passing through any nonmagical barrier or wall in its way. (Any magical barrier stops the arrow.) This ability negates cover, concealment, and even armor modifiers, but otherwise the attack is rolled normally. Using this ability is a standard action (and shooting the arrow is part of the action).;https://www.d20srd.org/srd/prestigeClasses/arcaneArcher.htm#phaseArrow;Spell-like Ability (Sp)
Hail of Arrows (Sp) (Arcane Archer);In lieu of her regular attacks, once per day an arcane archer of 8th level or higher can fire an arrow at each and every target within range, to a maximum of one target for every arcane archer level she has earned. Each attack uses the archer's primary attack bonus, and each enemy may only be targeted by a single arrow.;https://www.d20srd.org/srd/prestigeClasses/arcaneArcher.htm#hailOfArrows;Spell-like Ability (Sp)
Arrow of Death (Sp) (Arcane Archer);At 10th level, an arcane archer can create an arrow of death that forces the target, if damaged by the arrow's attack, to make a DC 20 Fortitude save or be slain immediately. It takes one day to make an arrow of death, and the arrow only functions for the arcane archer who created it. The arrow of death lasts no longer than one year, and the archer can only have one such arrow in existence at a time.;https://www.d20srd.org/srd/prestigeClasses/arcaneArcher.htm#arrowOfDeath;Spell-like Ability (Sp)
Ranged Legerdemain (Arcane Trickster);An arcane trickster can perform one of the following class skills at a range of 30 feet: Disable Device, Open Lock, or Sleight of Hand. Working at a distance increases the normal skill check DC by 5, and an arcane trickster cannot take 10 on this check. Any object to be manipulated must weigh 5 pounds or less. An arcane trickster can use ranged legerdemain once per day initially, twice per day upon attaining 5th level, and three times per day at 9th level or higher. He can make only one ranged legerdemain skill check each day, and only if he has at least 1 rank in the skill being used.;https://www.d20srd.org/srd/prestigeClasses/arcaneTrickster.htm#rangedLegerdemain;Other
Sneak Attack;If a character can catch an opponent when he is unable to defend himself effectively from her attack, she can strike a vital spot for extra damage. The character's attack deals extra damage any time her target would be denied a Dexterity bonus to AC (whether the target actually has a Dexterity bonus or not), or when the character flanks her target. Should the character score a critical hit with a sneak attack, this extra damage is not multiplied. Ranged attacks can count as sneak attacks only if the target is within 30 feet. With a sap (blackjack) or an unarmed strike, a character can make a sneak attack that deals nonlethal damage instead of lethal damage. She cannot use a weapon that deals lethal damage to deal nonlethal damage in a sneak attack, not even with the usual -4 penalty. A character can sneak attack only living creatures with discernible anatomies—undead, constructs, oozes, plants, and incorporeal creatures lack vital areas to attack. Any creature that is immune to critical hits is not vulnerable to sneak attacks. The character must be able to see the target well enough to pick out a vital spot and must be able to reach such a spot. A character cannot sneak attack while striking a creature with concealment or striking the limbs of a creature whose vitals are beyond reach.;https://www.d20srd.org/srd/classes/rogue.htm#sneakAttack;Damage
Impromptu Sneak Attack (Arcane Trickster);Beginning at 3rd level, once per day an arcane trickster can declare one melee or ranged attack he makes to be a sneak attack (the target can be no more than 30 feet distant if the impromptu sneak attack is a ranged attack). The target of an impromptu sneak attack loses any Dexterity bonus to AC, but only against that attack. The power can be used against any target, but creatures that are not subject to critical hits take no extra damage (though they still lose any Dexterity bonus to AC against the attack). At 7th level, an arcane trickster can use this ability twice per day.;https://www.d20srd.org/srd/prestigeClasses/arcaneTrickster.htm#impromptuSneakAttack;Other
Proficient with light armor;;;Proficiency
Proficient with medium armor;;;Proficiency
Proficient with heavy armor;;;Proficiency
Proficient with shields (except tower shields);;;Proficiency
Racial bonus on saves against enchantment spells or effects;;;Save
Racial bonus for specific skill;;;Skill
